"DESCRIPTION","DURATION IN MS","NAME","PARENT SUITE","START TIME","STATUS","STOP TIME","SUB SUITE","SUITE","TEST CLASS","TEST METHOD"
"Save the opened image as a reference image.","9614","test_save_as_reference_imageFile","tests","Sat Oct 26 01:14:03 UTC 2024","passed","Sat Oct 26 01:14:13 UTC 2024","TestImageComparisonSaveAs","Image Comparison Test with Preview App by SAVE AS Method","",""
"Test to open the Preview application.","2037","test_open_preview_application","tests","Sat Oct 26 01:14:14 UTC 2024","passed","Sat Oct 26 01:14:16 UTC 2024","TestImageComparisonExportAs","Image Comparison Test with Preview App by EXPORT Method","",""
"Test comparing IMAGE_1.jpg and IMAGE_2.png","1","test_compare_images","tests","Sat Oct 26 01:15:01 UTC 2024","failed","Sat Oct 26 01:15:01 UTC 2024","TestImageComparisonExportAs","Image Comparison Test with Preview App by EXPORT Method","",""
"Navigate to Directory and Open the Image","20857","test_select_image","tests","Sat Oct 26 01:13:42 UTC 2024","passed","Sat Oct 26 01:14:03 UTC 2024","TestImageComparisonSaveAs","Image Comparison Test with Preview App by SAVE AS Method","",""
"Navigate to Directory and Open the Image","20402","test_select_image","tests","Sat Oct 26 01:14:16 UTC 2024","passed","Sat Oct 26 01:14:36 UTC 2024","TestImageComparisonExportAs","Image Comparison Test with Preview App by EXPORT Method","",""
"Export The Image as JPEG Format","24430","test_export_JPEG_imageFile","tests","Sat Oct 26 01:14:36 UTC 2024","broken","Sat Oct 26 01:15:01 UTC 2024","TestImageComparisonExportAs","Image Comparison Test with Preview App by EXPORT Method","",""
"Test to open the Preview application.","2158","test_open_preview_application","tests","Sat Oct 26 01:13:40 UTC 2024","passed","Sat Oct 26 01:13:42 UTC 2024","TestImageComparisonSaveAs","Image Comparison Test with Preview App by SAVE AS Method","",""
"Test comparing IMAGE_1 and REF_Image.","1141","test_compare_images","tests","Sat Oct 26 01:14:13 UTC 2024","passed","Sat Oct 26 01:14:14 UTC 2024","TestImageComparisonSaveAs","Image Comparison Test with Preview App by SAVE AS Method","",""
