"DESCRIPTION","DURATION IN MS","NAME","PARENT SUITE","START TIME","STATUS","STOP TIME","SUB SUITE","SUITE","TEST CLASS","TEST METHOD"
"Navigate to Directory and Open the Image","22461","test_select_image","tests","Fri Oct 25 08:21:41 UTC 2024","passed","Fri Oct 25 08:22:03 UTC 2024","TestImageComparisonSaveAs","Image Comparison Test with Preview App by SAVE AS Method","",""
"Navigate to Directory and Open the Image","21032","test_select_image","tests","Fri Oct 25 08:22:13 UTC 2024","passed","Fri Oct 25 08:22:34 UTC 2024","TestImageComparisonExportAs","Image Comparison Test with Preview App by EXPORT Method","",""
"Test to open the Preview application.","2077","test_open_preview_application","tests","Fri Oct 25 08:22:11 UTC 2024","passed","Fri Oct 25 08:22:13 UTC 2024","TestImageComparisonExportAs","Image Comparison Test with Preview App by EXPORT Method","",""
"Test to open the Preview application.","2135","test_open_preview_application","tests","Fri Oct 25 08:21:38 UTC 2024","passed","Fri Oct 25 08:21:41 UTC 2024","TestImageComparisonSaveAs","Image Comparison Test with Preview App by SAVE AS Method","",""
"Save the opened image as a reference image.","7482","test_save_as_reference_imageFile","tests","Fri Oct 25 08:22:03 UTC 2024","passed","Fri Oct 25 08:22:11 UTC 2024","TestImageComparisonSaveAs","Image Comparison Test with Preview App by SAVE AS Method","",""
"Test comparing IMAGE_1 and REF_Image.","77","test_compare_images","tests","Fri Oct 25 08:22:11 UTC 2024","failed","Fri Oct 25 08:22:11 UTC 2024","TestImageComparisonSaveAs","Image Comparison Test with Preview App by SAVE AS Method","",""
"Save the opened image as a reference image.","18328","test_Export_JPEG_imageFile","tests","Fri Oct 25 08:22:34 UTC 2024","passed","Fri Oct 25 08:22:52 UTC 2024","TestImageComparisonExportAs","Image Comparison Test with Preview App by EXPORT Method","",""
"Test comparing IMAGE_1.jpg and IMAGE_2.png","5","test_compare_images","tests","Fri Oct 25 08:22:52 UTC 2024","failed","Fri Oct 25 08:22:52 UTC 2024","TestImageComparisonExportAs","Image Comparison Test with Preview App by EXPORT Method","",""
