"DESCRIPTION","DURATION IN MS","NAME","PARENT SUITE","START TIME","STATUS","STOP TIME","SUB SUITE","SUITE","TEST CLASS","TEST METHOD"
"Test comparing IMAGE_1 and REF_Image.","1512","test_compare_images","tests","Sun Oct 27 01:21:12 UTC 2024","passed","Sun Oct 27 01:21:13 UTC 2024","TestImageComparisonSaveAs","Image Comparison Test with Preview App by SAVE AS Method","",""
"Test to open the Preview application.","2083","test_open_preview_application","tests","Sun Oct 27 01:21:13 UTC 2024","passed","Sun Oct 27 01:21:15 UTC 2024","TestImageComparisonExportAs","Image Comparison Test with Preview App by EXPORT Method","",""
"Export The Image as JPEG Format","24374","test_export_JPEG_imageFile","tests","Sun Oct 27 01:21:36 UTC 2024","broken","Sun Oct 27 01:22:01 UTC 2024","TestImageComparisonExportAs","Image Comparison Test with Preview App by EXPORT Method","",""
"Test to open the Preview application.","2171","test_open_preview_application","tests","Sun Oct 27 01:20:39 UTC 2024","passed","Sun Oct 27 01:20:42 UTC 2024","TestImageComparisonSaveAs","Image Comparison Test with Preview App by SAVE AS Method","",""
"Navigate to Directory and Open the Image","20799","test_select_image","tests","Sun Oct 27 01:20:42 UTC 2024","passed","Sun Oct 27 01:21:02 UTC 2024","TestImageComparisonSaveAs","Image Comparison Test with Preview App by SAVE AS Method","",""
"Navigate to Directory and Open the Image","20849","test_select_image","tests","Sun Oct 27 01:21:15 UTC 2024","passed","Sun Oct 27 01:21:36 UTC 2024","TestImageComparisonExportAs","Image Comparison Test with Preview App by EXPORT Method","",""
"Test comparing IMAGE_1.jpg and IMAGE_2.png","1","test_compare_images","tests","Sun Oct 27 01:22:01 UTC 2024","failed","Sun Oct 27 01:22:01 UTC 2024","TestImageComparisonExportAs","Image Comparison Test with Preview App by EXPORT Method","",""
"Save the opened image as a reference image.","9398","test_save_as_reference_imageFile","tests","Sun Oct 27 01:21:02 UTC 2024","passed","Sun Oct 27 01:21:12 UTC 2024","TestImageComparisonSaveAs","Image Comparison Test with Preview App by SAVE AS Method","",""
